issuer_name,investment_description,asset_type,par_value,cost,current_value,units_or_shares,page_number,row_id,pdf_name,pdf_stem,sponsor_ein,plan_number,plan_year,sponsor,plan_name
,FIRST EAGLEOVERSEAS CLASS I,Mutual Fund,,,"422,097",,48,13,Fidelity_401K _5500.pdf,Fidelity_401K _5500,,001,2024,,
,FIRST EAGLEUS VALUE CLASS A,Mutual Fund,,,"90,413",,48,14,Fidelity_401K _5500.pdf,Fidelity_401K _5500,,001,2024,,
,FIRST FOUNDATIONTOTAL RETURN FUND Y,Mutual Fund,,,"226,648",,48,15,Fidelity_401K _5500.pdf,Fidelity_401K _5500,,001,2024,,
,FIRST TRUST ALTEROPPORTUNITIES CL I,Mutual Fund,,,"440,260",,48,16,Fidelity_401K _5500.pdf,Fidelity_401K _5500,,001,2024,,
,FIRST TRUST WCMFOCUSED GLOBAL GRWTH,Mutual Fund,,,"14,023",,48,17,Fidelity_401K _5500.pdf,Fidelity_401K _5500,,001,2024,,
,FIRSTHAND TECHNOLOGYOPPORTUNITIES FUND,Mutual Fund,,,"8,136",,48,18,Fidelity_401K _5500.pdf,Fidelity_401K _5500,,001,2024,,
,FIRSTHANDALTERNATIVE ENERGY,Mutual Fund,,,"3,388",,48,19,Fidelity_401K _5500.pdf,Fidelity_401K _5500,,001,2024,,
,FMI COMMON STOCKFUND,Mutual Fund,,,"563,583",,48,20,Fidelity_401K _5500.pdf,Fidelity_401K _5500,,001,2024,,
,FMI INTERNATIONAL,Mutual Fund,,,"692,288",,48,21,Fidelity_401K _5500.pdf,Fidelity_401K _5500,,001,2024,,
,FMI INTERNATIONALFUND INSTITUTIONAL,Mutual Fund,,,"15,223",,48,22,Fidelity_401K _5500.pdf,Fidelity_401K _5500,,001,2024,,
,FMI LARGE CAP FUND,Mutual Fund,,,"4,781",,48,23,Fidelity_401K _5500.pdf,Fidelity_401K _5500,,001,2024,,
,FORESTER VALUE FUND,Mutual Fund,,,"2,867",,48,24,Fidelity_401K _5500.pdf,Fidelity_401K _5500,,001,2024,,
,FPA CRESCENT FUND,Mutual Fund,,,"906,589",,48,25,Fidelity_401K _5500.pdf,Fidelity_401K _5500,,001,2024,,
,FPA QUEENS ROAD SMCAP VALUE INVSTR,Mutual Fund,,,"30,135",,48,26,Fidelity_401K _5500.pdf,Fidelity_401K _5500,,001,2024,,
,FRANKLIN BIOTECHDISCOVERY FUND A,Mutual Fund,,,"54,906",,48,27,Fidelity_401K _5500.pdf,Fidelity_401K _5500,,001,2024,,
,FRANKLIN DYNATECHCLASS C,Mutual Fund,,,"49,558",,48,28,Fidelity_401K _5500.pdf,Fidelity_401K _5500,,001,2024,,
,FRANKLIN DYNATECHFUND A,Mutual Fund,,,"323,245",,48,29,Fidelity_401K _5500.pdf,Fidelity_401K _5500,,001,2024,,
,FRANKLIN FLOATING RTDAILY ACCESS CL A,Mutual Fund,,,"1,000",,48,30,Fidelity_401K _5500.pdf,Fidelity_401K _5500,,001,2024,,
,FRANKLIN GOLD ANDPRECIOUS METALS CL A,Mutual Fund,,,"904,469",,48,31,Fidelity_401K _5500.pdf,Fidelity_401K _5500,,001,2024,,
,FRANKLIN INCOME CL A,Mutual Fund,,,"59,289",,48,32,Fidelity_401K _5500.pdf,Fidelity_401K _5500,,001,2024,,
,FRANKLIN INCOMECLASS A1,Mutual Fund,,,"3,997",,48,33,Fidelity_401K _5500.pdf,Fidelity_401K _5500,,001,2024,,
,FRANKLIN MANAGEDINCOME FUND CL A,Mutual Fund,,,"2,361",,48,34,Fidelity_401K _5500.pdf,Fidelity_401K _5500,,001,2024,,
,FRANKLIN MUTUALBEACON FUND CLASS A,Mutual Fund,,,"4,256",,48,35,Fidelity_401K _5500.pdf,Fidelity_401K _5500,,001,2024,,
,FRANKLIN MUTUALINTERNATL VALUE A,Mutual Fund,,,790,,48,36,Fidelity_401K _5500.pdf,Fidelity_401K _5500,,001,2024,,
,FRANKLIN MUTUALSHARES FD CLASS A,Mutual Fund,,,"44,409",,48,37,Fidelity_401K _5500.pdf,Fidelity_401K _5500,,001,2024,,
,FRANKLIN NATURALRESOURCES A,Mutual Fund,,,"1,207",,48,38,Fidelity_401K _5500.pdf,Fidelity_401K _5500,,001,2024,,
,FRANKLIN S&P 500INDEX FUND CL A,Mutual Fund,,,"1,362",,48,39,Fidelity_401K _5500.pdf,Fidelity_401K _5500,,001,2024,,
,FRANKLIN SMALL-MIDCAP GROWTH A,Mutual Fund,,,"10,594",,48,40,Fidelity_401K _5500.pdf,Fidelity_401K _5500,,001,2024,,
,FRANKLIN UTILITIESCL A,Mutual Fund,,,"42,070",,48,41,Fidelity_401K _5500.pdf,Fidelity_401K _5500,,001,2024,,
,FRANKLIN UTILITIESCLASS A1,Mutual Fund,,,"9,359",,48,42,Fidelity_401K _5500.pdf,Fidelity_401K _5500,,001,2024,,
,FRANKLIN UTILITIESCLASS C,Mutual Fund,,,"12,896",,48,43,Fidelity_401K _5500.pdf,Fidelity_401K _5500,,001,2024,,
,FRONTIER MFG COREINFRASTRUCTURE SERV,Mutual Fund,,,195,,48,44,Fidelity_401K _5500.pdf,Fidelity_401K _5500,,001,2024,,
,FROST CREDIT FUNDINVESTOR,Mutual Fund,,,"11,870",,48,45,Fidelity_401K _5500.pdf,Fidelity_401K _5500,,001,2024,,
,FROST TOTAL RETURNBOND FD INVESTOR,Mutual Fund,,,"17,193",,48,46,Fidelity_401K _5500.pdf,Fidelity_401K _5500,,001,2024,,
,FULLERTHALER BEHVSM CAP GROWTH INSTL,Mutual Fund,,,"462,566",,48,47,Fidelity_401K _5500.pdf,Fidelity_401K _5500,,001,2024,,
,FULLERTHALER BEHVSMALL CAP EQTY INV,Mutual Fund,,,"34,678",,48,48,Fidelity_401K _5500.pdf,Fidelity_401K _5500,,001,2024,,
,FULLERTHALER BEHVSMALL CAP GROWTH INV,Mutual Fund,,,"97,083",,48,49,Fidelity_401K _5500.pdf,Fidelity_401K _5500,,001,2024,,
,GABELLI EQUITYINCOME FUND AAA,Mutual Fund,,,392,,48,50,Fidelity_401K _5500.pdf,Fidelity_401K _5500,,001,2024,,
,GABELLI GOLD FUND CLA,Mutual Fund,,,"21,012",,49,1,Fidelity_401K _5500.pdf,Fidelity_401K _5500,,001,2024,,
,GABELLI GOLD FUND CLAAA,Mutual Fund,,,"426,771",,49,2,Fidelity_401K _5500.pdf,Fidelity_401K _5500,,001,2024,,
,GABELLI SMALL CAPGROWTH FUND CL I,Mutual Fund,,,"73,667",,49,3,Fidelity_401K _5500.pdf,Fidelity_401K _5500,,001,2024,,
,GATEWAY EQUITY CALLPREMIUM FUND CL A,Mutual Fund,,,"66,055",,49,4,Fidelity_401K _5500.pdf,Fidelity_401K _5500,,001,2024,,
,GEORGE PUTNAMBALANCED FUND CL A,Mutual Fund,,,"15,111",,49,5,Fidelity_401K _5500.pdf,Fidelity_401K _5500,,001,2024,,
,GLENMEDE LARGE CAPCORE,Mutual Fund,,,"205,856",,49,6,Fidelity_401K _5500.pdf,Fidelity_401K _5500,,001,2024,,
,GLENMEDE LARGE CAPGROWTH,Mutual Fund,,,"93,134",,49,7,Fidelity_401K _5500.pdf,Fidelity_401K _5500,,001,2024,,
,GLENMEDE LONG SHORTPORTFOLIO,Mutual Fund,,,"5,274",,49,8,Fidelity_401K _5500.pdf,Fidelity_401K _5500,,001,2024,,
,GLENMEDE SECUREDOPTIONS PORTFOLIO,Mutual Fund,,,"37,213",,49,9,Fidelity_401K _5500.pdf,Fidelity_401K _5500,,001,2024,,
,GLENMEDE SECUREDOPTIONS PORTFOLIO I,Mutual Fund,,,"6,647",,49,10,Fidelity_401K _5500.pdf,Fidelity_401K _5500,,001,2024,,
,GLENMEDE SMALL CAPEQUITY - ADVISOR CL,Mutual Fund,,,572,,49,11,Fidelity_401K _5500.pdf,Fidelity_401K _5500,,001,2024,,
,GLENMEDE TOTALMARKET PORTFOLIO,Mutual Fund,,,"46,816",,49,12,Fidelity_401K _5500.pdf,Fidelity_401K _5500,,001,2024,,
,GMO RESOURCES FUND I,Mutual Fund,,,"1,374",,49,13,Fidelity_401K _5500.pdf,Fidelity_401K _5500,,001,2024,,
,GMO SMALL CAPQUALITY FUND CL I,Mutual Fund,,,"13,650",,49,14,Fidelity_401K _5500.pdf,Fidelity_401K _5500,,001,2024,,
,GOEHRING &ROZENCWAJG RES INSTL,Mutual Fund,,,"605,646",,49,15,Fidelity_401K _5500.pdf,Fidelity_401K _5500,,001,2024,,
,GOLD AND PRECIOUSMETALS FUND,Mutual Fund,,,"30,894",,49,16,Fidelity_401K _5500.pdf,Fidelity_401K _5500,,001,2024,,
,GOLDMAN SACHS ABSOLURETURN TRACKER A,Mutual Fund,,,"5,976",,49,17,Fidelity_401K _5500.pdf,Fidelity_401K _5500,,001,2024,,
,GOLDMAN SACHS ASSETALLOC GR & INC STR A,Mutual Fund,,,"98,549",,49,18,Fidelity_401K _5500.pdf,Fidelity_401K _5500,,001,2024,,
,GOLDMAN SACHS CHINAEQUITY CLASS A,Mutual Fund,,,"30,617",,49,19,Fidelity_401K _5500.pdf,Fidelity_401K _5500,,001,2024,,
,GOLDMAN SACHS EMRGMKTS EQTY INSIGHTS I,Mutual Fund,,,"61,932",,49,20,Fidelity_401K _5500.pdf,Fidelity_401K _5500,,001,2024,,
,GOLDMAN SACHS ENERGYINFRASTRUCTURE A,Mutual Fund,,,"13,009",,49,21,Fidelity_401K _5500.pdf,Fidelity_401K _5500,,001,2024,,
,GOLDMAN SACHS ENHANDIV GLBL EQU PORT A,Mutual Fund,,,487,,49,22,Fidelity_401K _5500.pdf,Fidelity_401K _5500,,001,2024,,
,GOLDMAN SACHS GQGPART INTERNTL OPP A,Mutual Fund,,,"527,574",,49,23,Fidelity_401K _5500.pdf,Fidelity_401K _5500,,001,2024,,
,GOLDMAN SACHS GQGPARTNERS INTL OPP I,Mutual Fund,,,"715,164",,49,24,Fidelity_401K _5500.pdf,Fidelity_401K _5500,,001,2024,,
,GOLDMAN SACHS INCOMEBUILDER FUND A,Mutual Fund,,,"104,087",,49,25,Fidelity_401K _5500.pdf,Fidelity_401K _5500,,001,2024,,
,GOLDMAN SACHS INTLEQUITY ESG CL A,Mutual Fund,,,"18,313",,49,26,Fidelity_401K _5500.pdf,Fidelity_401K _5500,,001,2024,,
,GOLDMAN SACHS INTLEQUITY INCOME INSTL,Mutual Fund,,,"162,602",,49,27,Fidelity_401K _5500.pdf,Fidelity_401K _5500,,001,2024,,
,GOLDMAN SACHS INTLSM CAP INSIGHTS A,Mutual Fund,,,"46,798",,49,28,Fidelity_401K _5500.pdf,Fidelity_401K _5500,,001,2024,,
,GOLDMAN SACHS INTLSM CAP INSIGHTS INST,Mutual Fund,,,"129,237",,49,29,Fidelity_401K _5500.pdf,Fidelity_401K _5500,,001,2024,,
,GOLDMAN SACHS MIDCAP VALUE CLASS A,Mutual Fund,,,"29,341",,49,30,Fidelity_401K _5500.pdf,Fidelity_401K _5500,,001,2024,,
,GOLDMAN SACHS MLPENERGY INFRSTCTR A,Mutual Fund,,,"25,082",,49,31,Fidelity_401K _5500.pdf,Fidelity_401K _5500,,001,2024,,
,GOLDMAN SACHS SMALLCAP VALUE INSIGHTS A,Mutual Fund,,,"3,769",,49,32,Fidelity_401K _5500.pdf,Fidelity_401K _5500,,001,2024,,
,GOLDMAN SACHS TECHOPPORTUNITIES CL A,Mutual Fund,,,"26,183",,49,33,Fidelity_401K _5500.pdf,Fidelity_401K _5500,,001,2024,,
,GOLDMAN SACHS USEQUITY DIV PREM CL A,Mutual Fund,,,221,,49,34,Fidelity_401K _5500.pdf,Fidelity_401K _5500,,001,2024,,
,GOLDMAN SACHSCOMMODITY STRAT FD A,Mutual Fund,,,"4,721",,49,35,Fidelity_401K _5500.pdf,Fidelity_401K _5500,,001,2024,,
,GOODHAVEN FUND,Mutual Fund,,,"5,684",,49,36,Fidelity_401K _5500.pdf,Fidelity_401K _5500,,001,2024,,
,GOTHAM ABSOLUTERETURN FUND INSTL,Mutual Fund,,,"3,884",,49,37,Fidelity_401K _5500.pdf,Fidelity_401K _5500,,001,2024,,
,GOTHAM ENHANCEDRETURN FUND INSTL,Mutual Fund,,,"279,407",,49,38,Fidelity_401K _5500.pdf,Fidelity_401K _5500,,001,2024,,
,GOTHAM INDEX PLUSFUND INSTL,Mutual Fund,,,"67,811",,49,39,Fidelity_401K _5500.pdf,Fidelity_401K _5500,,001,2024,,
,GOTHAM INDEX PLUSFUND INVESTOR CL,Mutual Fund,,,"115,887",,49,40,Fidelity_401K _5500.pdf,Fidelity_401K _5500,,001,2024,,
,GOTHAM LARGE VALUEFUND INSTL CL,Mutual Fund,,,"3,610",,49,41,Fidelity_401K _5500.pdf,Fidelity_401K _5500,,001,2024,,
,GOTHAM NEUTRALFUND INSTITUTIONAL,Mutual Fund,,,"1,342",,49,42,Fidelity_401K _5500.pdf,Fidelity_401K _5500,,001,2024,,
,GQG PARTNERS EMERGMARKETS EQ INSTL,Mutual Fund,,,"144,300",,49,43,Fidelity_401K _5500.pdf,Fidelity_401K _5500,,001,2024,,
,GQG PARTNERS EMRGINGMARKETS EQUITY INV,Mutual Fund,,,"218,150",,49,44,Fidelity_401K _5500.pdf,Fidelity_401K _5500,,001,2024,,
,GQG PARTNERS GLOBALQUALITY DIV INC INV,Mutual Fund,,,"49,246",,49,45,Fidelity_401K _5500.pdf,Fidelity_401K _5500,,001,2024,,
,GQG PARTNERS GLOBALQUALITY EQ INVESTOR,Mutual Fund,,,"378,593",,49,46,Fidelity_401K _5500.pdf,Fidelity_401K _5500,,001,2024,,
,GQG PARTNERS GLOBALQUALITY EQUITY INSTL,Mutual Fund,,,"15,320",,49,47,Fidelity_401K _5500.pdf,Fidelity_401K _5500,,001,2024,,
,GQG PARTNERS US QLTYDIVIDEND INC INVEST,Mutual Fund,,,"229,790",,49,48,Fidelity_401K _5500.pdf,Fidelity_401K _5500,,001,2024,,
,GQG PARTNERS US QULTSELECT EQUITY INVSTR,Mutual Fund,,,"1,590,939",,49,49,Fidelity_401K _5500.pdf,Fidelity_401K _5500,,001,2024,,
,GQG PARTNERS USQUALITY SEL EQ INSTL,Mutual Fund,,,"163,456",,49,50,Fidelity_401K _5500.pdf,Fidelity_401K _5500,,001,2024,,
,GRANDEUR PEAK GLOBALSTALWARTS INSTL,Mutual Fund,,,"3,714",,50,1,Fidelity_401K _5500.pdf,Fidelity_401K _5500,,001,2024,,
,GRANDEUR PEAK INTLSTALWARTS INSTL,Mutual Fund,,,"3,771",,50,2,Fidelity_401K _5500.pdf,Fidelity_401K _5500,,001,2024,,
,GRANDEUR PEAK USSTALWARTS FUND INSTL,Mutual Fund,,,181,,50,3,Fidelity_401K _5500.pdf,Fidelity_401K _5500,,001,2024,,
,GUGGENHEIM CORE BONDFUND P,Mutual Fund,,,"15,137",,50,4,Fidelity_401K _5500.pdf,Fidelity_401K _5500,,001,2024,,
,GUGGENHEIM TOTALRETURN BOND CL P,Mutual Fund,,,"12,097",,50,5,Fidelity_401K _5500.pdf,Fidelity_401K _5500,,001,2024,,
,GUGGENHEIM TOTALRETURN BOND FD INSTL,Mutual Fund,,,"325,786",,50,6,Fidelity_401K _5500.pdf,Fidelity_401K _5500,,001,2024,,
,GUIDESTONE VALUEEQUITY FUND-INV CL,Mutual Fund,,,"2,712",,50,7,Fidelity_401K _5500.pdf,Fidelity_401K _5500,,001,2024,,
,GUINNESS ATKINSONALTERNATIVE ENERGY,Mutual Fund,,,"16,649",,50,8,Fidelity_401K _5500.pdf,Fidelity_401K _5500,,001,2024,,
,GUINNESS ATKINSONASIA FOCUS,Mutual Fund,,,"2,918",,50,9,Fidelity_401K _5500.pdf,Fidelity_401K _5500,,001,2024,,
,GUINNESS ATKINSONGLOBAL ENERGY,Mutual Fund,,,"51,847",,50,10,Fidelity_401K _5500.pdf,Fidelity_401K _5500,,001,2024,,
,GUINNESS ATKINSONGLOBAL INNOVATORS,Mutual Fund,,,"224,083",,50,11,Fidelity_401K _5500.pdf,Fidelity_401K _5500,,001,2024,,
,HARBOR CAP APP INST,Mutual Fund,,,"60,835",,50,12,Fidelity_401K _5500.pdf,Fidelity_401K _5500,,001,2024,,
,HARBOR CAP APP INV,Mutual Fund,,,"170,412",,50,13,Fidelity_401K _5500.pdf,Fidelity_401K _5500,,001,2024,,
,HARBOR DISRUPTIVEINNOVATION FD INST,Mutual Fund,,,"9,816",,50,14,Fidelity_401K _5500.pdf,Fidelity_401K _5500,,001,2024,,
,HARBOR DISRUPTIVEINNOVATION FD INVSTR,Mutual Fund,,,"3,983",,50,15,Fidelity_401K _5500.pdf,Fidelity_401K _5500,,001,2024,,
,HARBOR INTL INST,Mutual Fund,,,"83,158",,50,16,Fidelity_401K _5500.pdf,Fidelity_401K _5500,,001,2024,,
,HARBOR INTL INV,Mutual Fund,,,"15,177",,50,17,Fidelity_401K _5500.pdf,Fidelity_401K _5500,,001,2024,,
,HARBOR INTLSMCP INST,Mutual Fund,,,"37,653",,50,18,Fidelity_401K _5500.pdf,Fidelity_401K _5500,,001,2024,,
,HARBOR LARGE CAPVALUE INV CLASS,Mutual Fund,,,"30,798",,50,19,Fidelity_401K _5500.pdf,Fidelity_401K _5500,,001,2024,,
,HARDING LOEVNER FRNTEMERG MRKTS INVESTOR,Mutual Fund,,,"3,075",,50,20,Fidelity_401K _5500.pdf,Fidelity_401K _5500,,001,2024,,
,HARDING LOEVNER INTLEQUITY PORT INSTL,Mutual Fund,,,"7,591",,50,21,Fidelity_401K _5500.pdf,Fidelity_401K _5500,,001,2024,,
,HARDING LOEVNEREMERG MRKTS PORT ADV,Mutual Fund,,,"175,720",,50,22,Fidelity_401K _5500.pdf,Fidelity_401K _5500,,001,2024,,
,HARTFORD CORE EQUITYCLASS A,Mutual Fund,,,"524,074",,50,23,Fidelity_401K _5500.pdf,Fidelity_401K _5500,,001,2024,,
,HARTFORD CORE EQUITYCLASS Y,Mutual Fund,,,"346,651",,50,24,Fidelity_401K _5500.pdf,Fidelity_401K _5500,,001,2024,,
,HARTFORD DIVIDEND &GROWTH CLASS A,Mutual Fund,,,"23,200",,50,25,Fidelity_401K _5500.pdf,Fidelity_401K _5500,,001,2024,,
,HARTFORD GLOBALIMPACT CL A,Mutual Fund,,,"13,812",,50,26,Fidelity_401K _5500.pdf,Fidelity_401K _5500,,001,2024,,
,HARTFORD GROWTH OPPTFUND CL Y,Mutual Fund,,,819,,50,27,Fidelity_401K _5500.pdf,Fidelity_401K _5500,,001,2024,,
,HARTFORD GROWTHOPPORTUNITY CLASS A,Mutual Fund,,,"298,599",,50,28,Fidelity_401K _5500.pdf,Fidelity_401K _5500,,001,2024,,
,HARTFORD INTL VALUEFUND CLASS Y,Mutual Fund,,,"49,096",,50,29,Fidelity_401K _5500.pdf,Fidelity_401K _5500,,001,2024,,
,HARTFORD SCHRODEREMERG MKTS EQ CL Y,Mutual Fund,,,"2,273",,50,30,Fidelity_401K _5500.pdf,Fidelity_401K _5500,,001,2024,,
,HARTFORD SCHRODERSCHINA A FUND CL I,Mutual Fund,,,"17,945",,50,31,Fidelity_401K _5500.pdf,Fidelity_401K _5500,,001,2024,,
,HARTFORD SCHRODERSCHINA FUND CL A,Mutual Fund,,,"85,398",,50,32,Fidelity_401K _5500.pdf,Fidelity_401K _5500,,001,2024,,
,HARTFORD SCHRODERSEMRG MRKT EQTY CL A,Mutual Fund,,,"19,689",,50,33,Fidelity_401K _5500.pdf,Fidelity_401K _5500,,001,2024,,
,HARTFORD SCHRODERSINTL MULT CAP CL I,Mutual Fund,,,"112,481",,50,34,Fidelity_401K _5500.pdf,Fidelity_401K _5500,,001,2024,,
,HARTFORD SCHRODERSINTL MULTICAP CL A,Mutual Fund,,,"4,060",,50,35,Fidelity_401K _5500.pdf,Fidelity_401K _5500,,001,2024,,
,HARTFORD SCHRODERSINTL STOCK CL A,Mutual Fund,,,"37,530",,50,36,Fidelity_401K _5500.pdf,Fidelity_401K _5500,,001,2024,,
,HARTFORD STRATEGICINCOME FUND CL I,Mutual Fund,,,"31,761",,50,37,Fidelity_401K _5500.pdf,Fidelity_401K _5500,,001,2024,,
,HCM DIVIDEND SECTORPLUS FUND CL A,Mutual Fund,,,10,,50,38,Fidelity_401K _5500.pdf,Fidelity_401K _5500,,001,2024,,
,HCM DIVIDEND SECTORPLUS FUND INVESTOR,Mutual Fund,,,"48,113",,50,39,Fidelity_401K _5500.pdf,Fidelity_401K _5500,,001,2024,,
,HEALTH CARE ULTRASECTOR PRO FD INVSTR,Mutual Fund,,,"3,504,801",,50,40,Fidelity_401K _5500.pdf,Fidelity_401K _5500,,001,2024,,
,HEARTLAND MID CAPVALUE INSTL,Mutual Fund,,,"11,571",,50,41,Fidelity_401K _5500.pdf,Fidelity_401K _5500,,001,2024,,
,HEARTLAND MID CAPVALUE INVESTOR,Mutual Fund,,,"89,585",,50,42,Fidelity_401K _5500.pdf,Fidelity_401K _5500,,001,2024,,
,HEARTLAND VALUE,Mutual Fund,,,"85,071",,50,43,Fidelity_401K _5500.pdf,Fidelity_401K _5500,,001,2024,,
,HENNESSY CORNERSTONEGROWTH FUND INSTL,Mutual Fund,,,"48,304",,50,44,Fidelity_401K _5500.pdf,Fidelity_401K _5500,,001,2024,,
,HENNESSY CORNERSTONEGROWTH INV CL,Mutual Fund,,,"330,703",,50,45,Fidelity_401K _5500.pdf,Fidelity_401K _5500,,001,2024,,
,HENNESSY CORNERSTONELARGE GRWTH INV CL,Mutual Fund,,,"17,133",,50,46,Fidelity_401K _5500.pdf,Fidelity_401K _5500,,001,2024,,
,HENNESSY CORNERSTONEMID CAP 30 INSTL CL,Mutual Fund,,,"77,178",,50,47,Fidelity_401K _5500.pdf,Fidelity_401K _5500,,001,2024,,
,HENNESSY CORNERSTONEMID CAP 30 INV CL,Mutual Fund,,,"2,416,273",,50,48,Fidelity_401K _5500.pdf,Fidelity_401K _5500,,001,2024,,
,HENNESSY ENERGYTRANSITION INVESTOR,Mutual Fund,,,"33,577",,50,49,Fidelity_401K _5500.pdf,Fidelity_401K _5500,,001,2024,,
,HENNESSY FOCUS FUNDINSTITUTIONAL CL,Mutual Fund,,,"335,337",,51,1,Fidelity_401K _5500.pdf,Fidelity_401K _5500,,001,2024,,
,HENNESSY FOCUS FUNDINVESTOR CLASS,Mutual Fund,,,"213,366",,51,2,Fidelity_401K _5500.pdf,Fidelity_401K _5500,,001,2024,,
,HENNESSY GAS UTILITYINVESTOR CL,Mutual Fund,,,"124,346",,51,3,Fidelity_401K _5500.pdf,Fidelity_401K _5500,,001,2024,,
,HENNESSY JAPAN INSTLCL,Mutual Fund,,,"119,252",,51,4,Fidelity_401K _5500.pdf,Fidelity_401K _5500,,001,2024,,
,HENNESSY JAPAN INVSTCLASS,Mutual Fund,,,"124,357",,51,5,Fidelity_401K _5500.pdf,Fidelity_401K _5500,,001,2024,,
,HENNESSY JAPAN SMALLCAP CL INSTIT,Mutual Fund,,,"23,828",,51,6,Fidelity_401K _5500.pdf,Fidelity_401K _5500,,001,2024,,
,HENNESSY JAPAN SMALLCAP INVESTOR CL,Mutual Fund,,,"200,826",,51,7,Fidelity_401K _5500.pdf,Fidelity_401K _5500,,001,2024,,
,HENNESSY LARGE CAPFINANCIAL CL INST,Mutual Fund,,,20,,51,8,Fidelity_401K _5500.pdf,Fidelity_401K _5500,,001,2024,,
,HENNESSY LARGE CAPFINANCIAL INVSTR CL,Mutual Fund,,,"19,540",,51,9,Fidelity_401K _5500.pdf,Fidelity_401K _5500,,001,2024,,
,HENNESSY MIDSTREAMINV,Mutual Fund,,,"156,804",,51,10,Fidelity_401K _5500.pdf,Fidelity_401K _5500,,001,2024,,
,HENNESSY SMALL CAPFINANCIAL INSTIT CL,Mutual Fund,,,934,,51,11,Fidelity_401K _5500.pdf,Fidelity_401K _5500,,001,2024,,
,HENNESSY SMALL CAPFINANCIAL INVSTR CL,Mutual Fund,,,"31,575",,51,12,Fidelity_401K _5500.pdf,Fidelity_401K _5500,,001,2024,,
,HODGES BLUE CHIP EQINCOME FD RETAIL,Mutual Fund,,,728,,51,13,Fidelity_401K _5500.pdf,Fidelity_401K _5500,,001,2024,,
,HODGES FUND FUNDRETAIL CLASS,Mutual Fund,,,"47,902",,51,14,Fidelity_401K _5500.pdf,Fidelity_401K _5500,,001,2024,,
,HODGES SMALL CAPFUND RETAIL CLASS,Mutual Fund,,,"41,976",,51,15,Fidelity_401K _5500.pdf,Fidelity_401K _5500,,001,2024,,
,HODGES SMALL CAPINSTITUTIONAL CL,Mutual Fund,,,"3,841",,51,16,Fidelity_401K _5500.pdf,Fidelity_401K _5500,,001,2024,,
,HOOD RIVER SMALL CAPGROWTH FUND INSTL,Mutual Fund,,,"114,012",,51,17,Fidelity_401K _5500.pdf,Fidelity_401K _5500,,001,2024,,
,HORIZON MULTI FACTORU.S. EQUITY ADVISOR,Mutual Fund,,,107,,51,18,Fidelity_401K _5500.pdf,Fidelity_401K _5500,,001,2024,,
,HOTCHKIS & WILEY MIDCAP VALUE CL A,Mutual Fund,,,348,,51,19,Fidelity_401K _5500.pdf,Fidelity_401K _5500,,001,2024,,
,HOTCHKIS & WILEYHIGH YIELD FUND CL A,Mutual Fund,,,"3,922",,51,20,Fidelity_401K _5500.pdf,Fidelity_401K _5500,,001,2024,,
,HOTCHKIS & WILEYSMALL CAP VALUE CL A,Mutual Fund,,,"24,242",,51,21,Fidelity_401K _5500.pdf,Fidelity_401K _5500,,001,2024,,
,HOTCHKIS & WILEYSML CAP DIV VAL I,Mutual Fund,,,"35,786",,51,22,Fidelity_401K _5500.pdf,Fidelity_401K _5500,,001,2024,,
,HOTCHKIS & WILEYVALUE OPP CLASS A,Mutual Fund,,,"165,754",,51,23,Fidelity_401K _5500.pdf,Fidelity_401K _5500,,001,2024,,
,HUBER CAPITAL EQUITYINCOME FUND INSTL,Mutual Fund,,,"39,844",,51,24,Fidelity_401K _5500.pdf,Fidelity_401K _5500,,001,2024,,
,HUBER CAPITAL EQUITYINCOME FUND INVESTOR,Mutual Fund,,,325,,51,25,Fidelity_401K _5500.pdf,Fidelity_401K _5500,,001,2024,,
,HUSSMAN STRATEGICMARKET CYCLE,Mutual Fund,,,"66,986",,51,26,Fidelity_401K _5500.pdf,Fidelity_401K _5500,,001,2024,,
,ICON CONSUMERSELECT FUND INSTL,Mutual Fund,,,"29,535",,51,27,Fidelity_401K _5500.pdf,Fidelity_401K _5500,,001,2024,,
,ICON EQUITY FUNDINVESTOR,Mutual Fund,,,387,,51,28,Fidelity_401K _5500.pdf,Fidelity_401K _5500,,001,2024,,
,ICON HEALTH ANDINFORM TECH INSTL,Mutual Fund,,,"63,949",,51,29,Fidelity_401K _5500.pdf,Fidelity_401K _5500,,001,2024,,
,ICON NATURAL RESAND INFRA FUND INSTL,Mutual Fund,,,"118,749",,51,30,Fidelity_401K _5500.pdf,Fidelity_401K _5500,,001,2024,,
,IDX RISK MANAGEDBITCOIN FUND I,Mutual Fund,,,"10,029",,51,31,Fidelity_401K _5500.pdf,Fidelity_401K _5500,,001,2024,,
,IMAN FUND RETAILSHARES,Mutual Fund,,,"66,473",,51,32,Fidelity_401K _5500.pdf,Fidelity_401K _5500,,001,2024,,
,IMPAX ELLEVATE GLBLWOMENS LDERSP INV,Mutual Fund,,,469,,51,33,Fidelity_401K _5500.pdf,Fidelity_401K _5500,,001,2024,,
,IMPAX GLOBAL ENVIRONMARKETS INVESTOR,Mutual Fund,,,"61,471",,51,34,Fidelity_401K _5500.pdf,Fidelity_401K _5500,,001,2024,,
,IMPAX GLOBAL SUSTAININFRASTRUCTURE INSTL,Mutual Fund,,,224,,51,35,Fidelity_401K _5500.pdf,Fidelity_401K _5500,,001,2024,,
,IMPAX LARGE CAP FDINVESTOR,Mutual Fund,,,10,,51,36,Fidelity_401K _5500.pdf,Fidelity_401K _5500,,001,2024,,
,IMPAX SMALL CAPFD INVESTOR CL,Mutual Fund,,,"10,409",,51,37,Fidelity_401K _5500.pdf,Fidelity_401K _5500,,001,2024,,
,IMPAX SUSTAINABLEALLOCATION INVESTOR,Mutual Fund,,,"249,301",,51,38,Fidelity_401K _5500.pdf,Fidelity_401K _5500,,001,2024,,
,IMPAX US SUSTAINABLEECONOMY INSTL,Mutual Fund,,,"75,977",,51,39,Fidelity_401K _5500.pdf,Fidelity_401K _5500,,001,2024,,
,INDUSTRIALS ULTRASECTOR PRO FDS -INV,Mutual Fund,,,"4,333",,51,40,Fidelity_401K _5500.pdf,Fidelity_401K _5500,,001,2024,,
,INTERNET ULTRASECTORPRO FD INVESTOR,Mutual Fund,,,"69,214",,51,41,Fidelity_401K _5500.pdf,Fidelity_401K _5500,,001,2024,,
,INTREPID CAPITALFUND INVESTOR CLASS,Mutual Fund,,,3,,51,42,Fidelity_401K _5500.pdf,Fidelity_401K _5500,,001,2024,,
,INTREPID INCOMEFUND INSTITUTIONAL,Mutual Fund,,,"211,091",,51,43,Fidelity_401K _5500.pdf,Fidelity_401K _5500,,001,2024,,
,INVENOMIC INSTL CL,Mutual Fund,,,"474,755",,51,44,Fidelity_401K _5500.pdf,Fidelity_401K _5500,,001,2024,,
,INVENOMIC INVESTORCLASS,Mutual Fund,,,"86,037",,51,45,Fidelity_401K _5500.pdf,Fidelity_401K _5500,,001,2024,,
,INVESCO FLOATINGRATE ESG CLASS A,Mutual Fund,,,"38,551",,51,46,Fidelity_401K _5500.pdf,Fidelity_401K _5500,,001,2024,,
,INVESCO COMSTOCKFUND CL A,Mutual Fund,,,162,,51,47,Fidelity_401K _5500.pdf,Fidelity_401K _5500,,001,2024,,
,INVESCO COMSTOCKSELECT A,Mutual Fund,,,36,,51,48,Fidelity_401K _5500.pdf,Fidelity_401K _5500,,001,2024,,
,INVESCO CORE BOND A,Mutual Fund,,,"24,507",,51,49,Fidelity_401K _5500.pdf,Fidelity_401K _5500,,001,2024,,
,INVESCO CORPORATEBOND FUND CL A,Mutual Fund,,,"65,266",,51,50,Fidelity_401K _5500.pdf,Fidelity_401K _5500,,001,2024,,
,INVESCO DIVERSIFIEDDIVIDEND CLASS A,Mutual Fund,,,"53,708",,52,1,Fidelity_401K _5500.pdf,Fidelity_401K _5500,,001,2024,,
,INVESCO DIVERSIFIEDDIVIDEND FUND CL R5,Mutual Fund,,,"4,959",,52,2,Fidelity_401K _5500.pdf,Fidelity_401K _5500,,001,2024,,
,INVESCO DIVIDENDINCOME FUND A,Mutual Fund,,,"12,953",,52,3,Fidelity_401K _5500.pdf,Fidelity_401K _5500,,001,2024,,
,INVESCO ENERGY CLASSA,Mutual Fund,,,"74,674",,52,4,Fidelity_401K _5500.pdf,Fidelity_401K _5500,,001,2024,,
,INVESCO EQUALLYWEIGHTED S&P 500 A,Mutual Fund,,,"294,033",,52,5,Fidelity_401K _5500.pdf,Fidelity_401K _5500,,001,2024,,
,INVESCO EQV EUROPEANEQUITY CLASS A,Mutual Fund,,,"9,062",,52,6,Fidelity_401K _5500.pdf,Fidelity_401K _5500,,001,2024,,
,INVESCO GLOBAL A,Mutual Fund,,,"1,874",,52,7,Fidelity_401K _5500.pdf,Fidelity_401K _5500,,001,2024,,
,INVESCO GLOBALOPPORTUNITIES A,Mutual Fund,,,"122,249",,52,8,Fidelity_401K _5500.pdf,Fidelity_401K _5500,,001,2024,,
,INVESCO GLOBALOPPORTUNITIES R,Mutual Fund,,,"10,485",,52,9,Fidelity_401K _5500.pdf,Fidelity_401K _5500,,001,2024,,
,INVESCO GOLD & SPECMINERALS A,Mutual Fund,,,"1,469,365",,52,10,Fidelity_401K _5500.pdf,Fidelity_401K _5500,,001,2024,,
,INVESCO GREATERCHINA CLASS A,Mutual Fund,,,"3,182",,52,11,Fidelity_401K _5500.pdf,Fidelity_401K _5500,,001,2024,,
,INVESCO INTL SMALLMID COMPANY A,Mutual Fund,,,"279,655",,52,12,Fidelity_401K _5500.pdf,Fidelity_401K _5500,,001,2024,,
,INVESCO S&P 500INDEX CLASS A,Mutual Fund,,,"158,600",,52,13,Fidelity_401K _5500.pdf,Fidelity_401K _5500,,001,2024,,
,INVESCO SENIORFLOATING RATE A,Mutual Fund,,,"36,444",,52,14,Fidelity_401K _5500.pdf,Fidelity_401K _5500,,001,2024,,
,INVESCO SMALL CAPVALUE FUND CL A,Mutual Fund,,,741,,52,15,Fidelity_401K _5500.pdf,Fidelity_401K _5500,,001,2024,,
,INVESCO STEELPATHMLP ALPHA A,Mutual Fund,,,645,,52,16,Fidelity_401K _5500.pdf,Fidelity_401K _5500,,001,2024,,
,INVESCO STEELPATHMLP ALPHA PLUS A,Mutual Fund,,,"34,689",,52,17,Fidelity_401K _5500.pdf,Fidelity_401K _5500,,001,2024,,
,INVESCO STEELPATHMLP INCOME A,Mutual Fund,,,"782,594",,52,18,Fidelity_401K _5500.pdf,Fidelity_401K _5500,,001,2024,,
,INVESCO STEELPATHMLP SELECT 40 A,Mutual Fund,,,"9,538",,52,19,Fidelity_401K _5500.pdf,Fidelity_401K _5500,,001,2024,,
,INVESCO SUMMITCLASS A,Mutual Fund,,,584,,52,20,Fidelity_401K _5500.pdf,Fidelity_401K _5500,,001,2024,,
,INVESCO TECHNOLOGYCLASS A,Mutual Fund,,,"22,696",,52,21,Fidelity_401K _5500.pdf,Fidelity_401K _5500,,001,2024,,
,INVESCO VALUEOPPORTUNITIES FUND A,Mutual Fund,,,202,,52,22,Fidelity_401K _5500.pdf,Fidelity_401K _5500,,001,2024,,
,IRONCLAD MANAGEDRISK FUND,Mutual Fund,,,"6,225",,52,23,Fidelity_401K _5500.pdf,Fidelity_401K _5500,,001,2024,,
,ISHARES S&P 500INDEX INSTITUTIONAL,Mutual Fund,,,"174,249",,52,24,Fidelity_401K _5500.pdf,Fidelity_401K _5500,,001,2024,,
,ISHARES S&P 500INDEX INVESTOR A,Mutual Fund,,,"1,525,864",,52,25,Fidelity_401K _5500.pdf,Fidelity_401K _5500,,001,2024,,
,ISHARES DEVELOPEDREAL ESTATE IDX INST,Mutual Fund,,,"26,511",,52,26,Fidelity_401K _5500.pdf,Fidelity_401K _5500,,001,2024,,
,ISHARES DEVELOPEDRL ESTATE IDX INV A,Mutual Fund,,,"6,606",,52,27,Fidelity_401K _5500.pdf,Fidelity_401K _5500,,001,2024,,
,ISHARES MSCI EAFEINTL IDX CL A,Mutual Fund,,,"1,504",,52,28,Fidelity_401K _5500.pdf,Fidelity_401K _5500,,001,2024,,
